{
  "$schema": "https://json-schema.org/draft/2020-12/schema",
  "$id": "https://kujo.dev/relay/schemas/mission.schema.json",
  "title": "Kujo Relay mission",
  "type": "object",
  "required": ["name", "goal", "repository", "actions"],
  "properties": {
    "version": {"type": "string"},
    "id": {"type": "string", "maxLength": 160},
    "name": {"type": "string", "minLength": 1, "maxLength": 160},
    "goal": {"type": "string", "minLength": 1, "maxLength": 65536},
    "workflow": {"type": "string"},
    "repository": {"type": "string", "minLength": 1},
    "starting_commit": {"type": "string"},
    "workspace_mode": {"enum": ["provided", "worktree"]},
    "allow_writes": {"type": "boolean"},
    "approval": {"type": "object"},
    "model": {"type": "string"},
    "provider": {"type": "string"},
    "allowed_commands": {"type": "array", "items": {"type": "string"}, "maxItems": 16},
    "acceptance_criteria": {"type": "array", "items": {"type": "string"}, "maxItems": 64},
    "budgets": {"type": "object"},
    "agent_tools": {"type": "array", "maxItems": 16},
    "agent_tool_mode": {"enum": ["declared", "provider"]},
    "agent_tool_allowlist": {"type": "array", "items": {"enum": ["relay.write_file", "relay.run_command"]}, "maxItems": 2, "uniqueItems": true},
    "actions": {
      "type": "array",
      "maxItems": 32,
      "items": {
        "type": "object",
        "required": ["type"],
        "properties": {
          "type": {"enum": ["write_file", "run_command"]},
          "path": {"type": "string"},
          "content": {"type": "string"},
          "command": {"type": "string"},
          "timeout_ms": {"type": "integer", "minimum": 1, "maximum": 600000}
        }
      }
    }
  },
  "additionalProperties": true
}
