{"version": "1.0.0", "id": "relay-provider-tools-mission", "name": "relay-provider-tools-mission", "goal": "You must call relay.write_file exactly once to create mission-plan.md with a concise bounded mission plan, then submit the final answer. Do not answer without using the tool.", "workflow": "verified-feature", "repository": "/private/tmp/relay-pinned-live-07kswb9a/workspace", "provider": "openai-compatible", "model": "glm-5.3-flash", "agent_tool_mode": "provider", "agent_tool_allowlist": ["relay.write_file"], "allow_writes": true, "approval": {"approved": true, "actor": "owner-approved-relay-verification", "reason": "User approved bounded tool mission in disposable workspace"}, "allowed_commands": ["git"], "budgets": {"max_steps": 2, "max_repairs": 0, "max_tokens": 4000, "max_tool_calls": 2, "max_tool_turns": 2, "max_output_bytes": 1048576, "max_write_bytes": 1048576}, "acceptance_criteria": ["the provider-generated tool-created file exists", "git diff --check passes"], "actions": []}